{
  "buttons": [
    [
      "Предыдущая страница",
      "Случайная статья",
      "Следующая страница"
    ],
    [
      "В начало"
    ]
  ],
  "message": "Вот список статей в категории «{{CATEGORY}}»",
  "one_time_keyboard": false,
  "transitions": {
    "/start": "Start",
    "В начало": "Start",
    "Предыдущая страница": "THIS",
    "Следующая страница": "THIS",
    "Случайная статья": "THIS"
  }
}
