{
  "buttons": [
    [
      "PLACEHOLDER"
    ],
    [
      "Предыдущий вопрос",
      "Назад",
      "Завершить тест"
    ]
  ],
  "inline_buttons": true,
  "message": "Вопрос №{{INDEX}} (из {{TOTAL}}) теста «{{NAME}}»",
  "transitions": {
    "/start": "Start",
    "PLACEHOLDER": "NotImplemented",
    "Назад": "THIS"
  }
}
