{
  "buttons": [
    [
      "Предыдущая страница",
      "Случайная техника",
      "Следующая страница"
    ],
    [
      "В начало"
    ]
  ],
  "message": "Нажмите случайный выбор или введите номер техники",
  "one_time_keyboard": false,
  "transitions": {
    "/start": "Start",
    "В начало": "Start",
    "Предыдущая страница": "THIS",
    "Следующая страница": "THIS",
    "Случайная техника": "THIS"
  }
}
