{
  "buttons": [
    [
      "Книги",
      "Фильмы",
      "Сериалы"
    ],
    [
      "Назад"
    ]
  ],
  "inline_buttons": true,
  "message": "Не знаете что еще прочесть или посмотреть по психологии? Выбирайте категорию и мы поможем вам не заскучать в свободный вечер",
  "transitions": {
    "/start": "Start",
    "Книги": "BookRecommendations",
    "Назад": "Start",
    "Сериалы": "SeriesRecommendations",
    "Фильмы": "FilmRecommendations"
  }
}
