{
  "buttons": [
    [
      "PLACEHOLDER"
    ],
    [
      "Назад"
    ]
  ],
  "inline_buttons": true,
  "message": "Раздел содержит различные техники улучшения собственной осознанной жизни. Собранные нами техники помогут вам в этом.",
  "transitions": {
    "/start": "Start",
    "PLACEHOLDER": "NotImplemented",
    "Назад": "Start"
  }
}
